ID,POSITIVE,NEGATIVE
306,ਜੇ ਤੁਸੀਂ ਇਸ ਕਿਸਮ ਦੀ ਚੀਜ਼ ਨਾਲ ਜੁੜੇ ਹੋ ਤਾਂ ਰੁਕੋ ਅਤੇ ਇਸ ਦੀ ਜਾਂਚ ਕਰੋ!,"ਭਾਵੇਂ ਤੁਸੀਂ ਇਸ ਕਿਸਮ ਦੀ ਚੀਜ਼ ਨਾਲ ਜੁੜੇ ਹੋ, ਇਹ ਚੈੱਕ ਕਰਨ ਦੇ ਯੋਗ ਨਹੀਂ ਹੈ।"
307,ਮੈਂ ਆਪਣੇ ਦੁਪਹਿਰ ਦੇ ਖਾਣੇ ਸਮੇ ਸਲੈਸ ਲੈਣ ਲਈ ਇੱਥੇ ਆਉਂਦੇ ਹਾਂ।,ਮੈਂ ਇੱਥੇ ਦੁਪਹਿਰ ਦੇ ਖਾਣੇ ਲਈ ਆਉਣਾ ਅਤੇ ਸਲਾਈਸ ਲੈਣਾ ਨਾਪਸੰਦ ਕਰਦਾ ਹਾਂ।
308,ਇਹ ਫੀਨਿਕਸ ਖੇਤਰ ਤੋਂ ਅੱਧੇ ਦਿਨ ਦੇ ਸਮੇਂ ਦੀ ਯਾਤਰਾ ਹੈ।,ਇਹ ਫੀਨਿਕਸ ਖੇਤਰ ਤੋਂ ਇੱਕ ਲੰਮੀ ਅੱਧੇ ਦਿਨ ਦੀ ਯਾਤਰਾ ਹੈ।
309,ਮੈਨੂੰ ਜਗ੍ਹਾ ਦੇ ਵਾਈਬ ਨਾਲ ਪਿਆਰ ਹੈ!,ਮੈਨੂੰ ਇਸ ਜਗ੍ਹਾ ਦੀ ਵਾਈਬ ਨਾਲ ਨਫ਼ਰਤ ਹੈ!
310,ਸਾਰੇ ਕਰਮਚਾਰੀ ਬਹੁਤ ਦੋਸਤਾਨਾ ਸਨ ਅਤੇ ਆਪਣੇ ਕੰਮ ਵਿੱਚ ਮਾਹਰ ਹਨ।,ਕਰਮਚਾਰੀ ਦੋਸਤਾਨਾ ਨਹੀਂ ਹਨ ਅਤੇ ਆਪਣੇ ਕੰਮ ਵਿੱਚ ਮਾਹਰ ਨਹੀਂ ਹਨ
311,ਮੱਕੀ ਦੀ ਰੋਟੀ ਵੀ ਚੰਗੀ ਸੀ!,ਮੱਕੀ ਦੀ ਰੋਟੀ ਬੇਹੀ ਸੀ
312,ਖਾਣਾ ਬਹੁਤ ਵਧੀਆ ਅਤੇ ਚੰਗੀ ਕੀਮਤ।,ਖਾਣਾ ਬਹੁਤ ਜ਼ਿਆਦਾ ਕੀਮਤ ਵਾਲਾ ਸੀ
313,ਉਹਨਾਂ ਨੂੰ ਰੋਕ ਕਲਾਈਂਬ ਪਸੰਦ ਸੀ,ਉਹਨਾਂ ਨੂੰ ਰੋਕ ਕਲਾਈਂਬ ਨਾਲ ਨਫਰਤ ਸੀ
314,ਬਹੁਤ ਵਧੀਆ ਸਵਾਦ ਅਤੇ ਚੇਨ ਦੇ ਸਬ ਜੋਆਇੰਟਸ ਨਾਲੋਂ ਬਹੁਤ ਵਧੀਆ ਸੌਦਾ।,ਬਿਲਕੁਲ ਫਿੱਕਾ ਅਤੇ ਚੇਨ ਦੇ ਸਬ ਜੋਆਇੰਟਸ ਨਾਲੋਂ ਬੁਰਾ ਸੌਦਾ।
315,ਹੁਣ ਤੱਕ ਦਾ ਸਭ ਤੋਂ ਵਧੀਆ ਤਜਰਬਾ ਜੋ ਮੈਨੂੰ ਕਦੇ ਆਟੋ ਦੀ ਦੁਕਾਨ ਵਿੱਚ ਮਿਲਿਆ।,ਹੁਣ ਤੱਕ ਦਾ ਸਭ ਤੋਂ ਬੁਰਾ ਤਜਰਬਾ ਜੋ ਮੈਨੂੰ ਕਦੇ ਆਟੋ ਦੀ ਦੁਕਾਨ ਵਿੱਚ ਮਿਲਿਆ।
316,ਮੇਰੇ ਇੱਥੇ ਜਾਣ ਦੇ ਮੇਰੇ ਫੈਸਲੇ ਨਾਲ ਬਹੁਤ ਖੁਸ਼।,ਇੱਥੇ ਜਾਣ ਦੇ ਮੇਰੇ ਫੈਸਲੇ ਤੋਂ ਇੰਨਾ ਨਾਖੁਸ਼।
317,ਇਹ ਬਹੁਤ ਸਸਤਾ ਸੀ ਅਤੇ ਉਨ੍ਹਾਂ ਨੇ ਚੰਗੇ ਮਿਊਜ਼ਿਕ ਵੀਡੀਓ ਚਲਾਏ।,ਇਹ ਬਹੁਤ ਮਹਿੰਗਾ ਸੀ ਅਤੇ ਮਾੜੇ ਮਿਊਜ਼ਿਕ ਵੀਡੀਓ ਚਲਾਏ।
318,ਬਹੁਤ ਥ੍ਰੋਬੈਕ ਮਾਹੌਲ ਵਿੰਟੇਜ ਆਈਸ ਕਰੀਮ ਪਾਰਲਰ।,ਬਹੁਤ ਥ੍ਰੋਬੈਕ ਮਾਹੌਲ; ਪੁਰਾਣੀ ਆਈਸ ਕਰੀਮ ਪਾਰਲਰ
319,ਬਾਰ ਤੇ ਬੈਠੋ ਅਤੇ ਛੋਟੀਆਂ ਪਲੇਟਾਂ ਨੂੰ ਖਾਓ।,ਬਾਰ ਤੇ ਨਾ ਬੈਠੋ ਅਤੇ ਛੋਟੀਆਂ ਪਲੇਟਾਂ ਤੋਂ ਬਚੋ
320,ਮੈਦਾਨ ਹਮੇਸ਼ਾਂ ਬਹੁਤ ਸਾਫ ਹੁੰਦੇ ਹਨ।,ਮੈਦਾਨ ਹਮੇਸ਼ਾਂ ਬਹੁਤ ਗੰਦੇ ਹੁੰਦੇ ਹਨ।
321,ਮੈਂ ਬੱਸ ਇਕ ਮਜ਼ੇਦਾਰ ਠਹਿਰਨ ਤੋਂ ਵਾਪਸ ਆਇਆ।,ਮੈਂ ਬੱਸ ਇਕ ਬੇਕਾਰ ਠਹਿਰੇ ਤੋਂ ਵਾਪਸ ਆਇਆ।
322,"ਇੱਕ ਸਟੀਕ, ਸ਼ਰਿੰਪ ਅਤੇ ਇੱਕ ਐਨਕੀਲਾਡਾ।","ਇੱਕ ਸਖ਼ਤ ਸਟੀਕ, ਛੋਟੇ ਸ਼ਰਿੰਪ ਅਤੇ ਇੱਕ ਦਰਮਿਆਨੀ ਐਨਕੀਲਾਡਾ।"
323,ਉਹ ਲੋੜ ਤੋਂ ਵੀ ਜਿਆਦਾ ਮਿਹਨਤ ਕਰਦੇ ਹਨ!,ਉਨ੍ਹਾਂ ਨੇ ਕੋਈ ਹੋਰ ਮਿਹਨਤ ਨਹੀਂ ਕੀਤੀ!
324,ਮੈਂ ਇੱਥੇ ਕਈ ਵਾਰ ਆਇਆ ਹਾਂ ਅਤੇ ਹਰ ਵਾਰ ਵਧੀਆ ਰਿਹਾ।,ਮੈਂ ਇੱਥੇ ਕਈ ਵਾਰ ਗਿਆ ਹਾਂ ਅਤੇ ਹਰ ਵਾਰ ਨਿਰਾਸ਼ਾਜਨਕ ਰਿਹਾ।
325,ਚੰਗੀ ਖਬਰ ਇਹ ਹੈ ਕਿ ਮੇਰੀ ਨਜ਼ਰ ਵਿੱਚ ਸੁਧਾਰ ਹੋਇਆ ਸੀ ਜਿਸਨੇ ਫੇਰੀ ਨੂੰ ਬਿਹਤਰ ਬਣਾ ਦਿੱਤਾ ਹੈ।,ਬੁਰੀ ਖਬਰ ਇਹ ਹੈ ਕਿ ਮੇਰੀ ਨਜ਼ਰ ਵਿੱਚ ਵਿਗੜ ਗਈ ਸੀ ਜਿਸਨੇ ਫੇਰੀ ਨੂੰ ਬਦਤਰ ਬਣਾ ਦਿੱਤਾ ਹੈ।
326,ਆਰਾਮ ਕਰਨ ਅਤੇ ਸਵੱਛ ਹੋਣ ਲਈ ਇਹ ਬਹੁਤ ਵਧੀਆ ਸਥਾਨ ਹੈ।,ਇਹ ਸਲਾਭੀ ਹੋਈ ਜਗ੍ਹਾ ਹੈ
327,ਅਸੀਂ ਹਰ ਜਾਣਕਾਰ ਨੂੰ ਆਯਾਤ ਅਤੇ ਅਮਰੀਕਨ ਆਟੋ ਸਰਵਿਸ ਦੀ ਸਿਫਾਰਸ਼ ਕਰਦੇ ਹਾਂ,ਅਸੀਂ ਕਿਸੇ ਨੂੰ ਵੀ ਕਿਸੇ ਨੂੰ ਆਯਾਤ ਜਾਂ ਅਮੈਰੀਕਨ ਆਟੋ ਸਰਵਿਸ ਦੀ ਸਿਫਾਰਸ਼ ਨਹੀਂ ਕਰਾਂਗੇ।
328,"ਕੁੜੀਆਂ ਬਹੁਤ ਆਕਰਸ਼ਕ ਅਤੇ ਅਸਲ ਵਿੱਚ ਦੋਸਤਾਨਾ ਹੁੰਦੀਆਂ ਹਨ, ਬਿਲਕੁਲ ਘਮੰਡੀ ਨਹੀਂ।","ਕੁੜੀਆਂ ਨਾ ਤਾਂ ਦੋਸਤਾਨਾ ਹਨ ਅਤੇ ਨਾ ਹੀ ਆਕਰਸ਼ਕ ਹਨ, ਅਤੇ ਥੋੜ੍ਹੀਆਂ ਘਮੰਡੀ ਸਨ"
329,ਇਹ ਸ਼ਾਂਤ ਹੈ ਅਤੇ ਇੱਥੇ ਚੰਗੇ ਲੋਕ ਹਨ।,ਇਸ ਦੇ ਸ਼ੋਰ ਨਾਲ ਭਰਿਆ ਹੈ ਅਤੇ ਬੇਕਾਰ ਲੋਕ ਇੱਥੇ ਹਨ।
330,ਇੱਥੇ ਐਜ਼ ਵਿਚ ਰਹਿਣ ਦੌਰਾਨ ਬਹੁਤ ਸੁਆਦ ਵ੍ਹਾਈਟ ਪੀਜ਼ਾ ਘਰ ਲੈ ਕੇ ਗਿਆ।,ਇੱਥੇ ਐਜ਼ ਵਿਚ ਰਹਿਣ ਦੌਰਾਨ ਬਹੁਤ ਬੇਸੁਆਦ ਵ੍ਹਾਈਟ ਪੀਜ਼ਾ ਘਰ ਲੈ ਕੇ ਗਿਆ।
331,ਕਈ ਹੋਰ ਗਾਇਰੋ ਪਲੇਸ ਖਾਣ ਤੋਂ ਬਾਅਦ ਕਿੰਗਜ਼ ਦੀ ਅਜੇ ਵੀ ਸਭ ਤੋਂ ਵਧੀਆ ਸਾਸ ਹੈ।,ਕਈ ਹੋਰ ਗਾਇਰੋ ਪਲੇਸ ਖਾਣ ਤੋਂ ਬਾਅਦ ਕਿੰਗਜ਼ ਦੀ ਸਭ ਤੋਂ ਘਟੀਆ ਸਾਸ ਹੈ।
332,ਸੇਵਾ ਬਹੁਤ ਵਧੀਆ ਸੀ ਅਤੇ ਭੋਜਨ ਹੋਰ ਵੀ ਵਧੀਆ ਸੀ।,ਸੇਵਾ ਮਾੜੀ ਸੀ ਅਤੇ ਭੋਜਨ ਹੋਰ ਵੀ ਭੈੜਾ ਸੀ।
333,ਸੁਜ਼ੈਨ ਅਤੇ ਉਸ ਦਾ ਸਟਾਫ ਸ਼ਾਨਦਾਰ ਸਨ!,ਸੁਜ਼ੈਨ ਅਤੇ ਉਸਦੇ ਅਮਲੇ ਬੇਕਾਰ ਸਨ!
334,ਸਾਰੇ ਬਹੁਤ ਚੰਗੇ ਹਨ!,ਸਾਰੇ ਬਹੁਤ ਮਾੜੇ ਹਨ!
335,"ਤੇਜ਼, ਦੋਸਤਾਨਾ ਅਤੇ ਇਮਾਨਦਾਰ ਸੇਵਾ।","ਹੌਲੀ, ਗੈਰ-ਦੋਸਤਾਨਾ ਅਤੇ ਬੇਈਮਾਨ ਸੇਵਾ।"
336,"ਬਹੁਤ ਵਧੀਆ ਖਾਣਾ, ਬਹੁਤ ਵਧੀਆ ਸੇਵਾ, ਉਨ੍ਹਾਂ ਦਾ ਕੈਟਰਿੰਗ ਦਾ ਕੋਈ ਮੁਕਾਬਲਾ ਨਹੀਂ ","ਬੇਕਾਰ ਖਾਣਾ, ਬੇਕਾਰ ਸੇਵਾ, ਕੇਟਰਿੰਗ ਵਾਹਿਆਤ ਹੈ।"
337,ਮੈਂ ਇੱਥੇ ਸਭ ਤੋਂ ਵਧੀਆ ਪੋਰਕ ਬੈਲੀ ਖਾਧੀ,ਮੈਂ ਇੱਥੇ ਸਭ ਤੋਂ ਭੈੜੀ ਪੋਰਕ ਬੈਲੀ ਖਾਧੀ
338,ਤੁਸੀਂ ਦੱਸ ਸਕਦੇ ਹੋ ਕਿ ਸਮੱਗਰੀ ਕਿਵੇਂ ਸੀ।,ਸਮੱਗਰੀ ਬਹੁਤ ਪੁਰਾਣੀ ਸੀ
339,ਮੈਂ ਯਕੀਨਨ ਦੁਬਾਰਾ ਵਾਪਸ ਜਾਵਾਂਗਾ।,ਮੈਂ ਉਥੇ ਵਾਪਸ ਨਹੀਂ ਜਾਵਾਂਗਾ।
340,"ਕੂਪਨ ਹੋਵੇ ਜਾਂ ਨਾ ਹੋਵੇ, ਇਹ ਜਗ੍ਹਾ ਬਹੁਤ ਹੀ ਵਧੀਆ ਹੈ ਅਤੇ ਬਹੁਤ ਵਧੀਆ ਮੁੱਲ।",ਜਗ੍ਹਾ ਬੇਕਾਰ ਅਤੇ ਬੇਕਾਰ ਮੁੱਲ ਸੀ।
341,ਇਹ ਸ਼ਹਿਰ ਵਿੱਚ ਸਰਬੋਤਮ ਸੀ ਫ਼ੂਡ ਹੈ।,ਇਹ ਸ਼ਹਿਰ ਵਿਚ ਸਭ ਤੋਂ ਭੈੜਾ ਸੀ ਫ਼ੂਡ ਵਾਲਾ ਜੋਇੰਟ ਹੈ
342,ਸ਼ਾਨਦਾਰ ਸੇਵਾ ਜਾਰੀ ਰੱਖੋ!,ਬੇਕਾਰ ਸੇਵਾ ਨੂੰ ਜਾਰੀ ਰੱਖੋ!
343,"ਹਰ ਵਾਰ ਜਦੋਂ ਮੈਂ ਮੈਕਸੀਕਨ ਖਾਣੇ ਦੀ ਲਾਲਸਾ ਕਰਦਾ ਹਾਂ, ਮੈਂ ਇੱਥੇ ਜਾਂਦਾ ਹਾਂ!","ਹਰ ਵਾਰ ਜਦੋਂ ਮੈਂ ਮੈਕਸੀਕਨ ਖਾਣੇ ਦੀ ਇੱਛਾ ਰੱਖਦਾ ਹਾਂ, ਮੈਂ ਇਸ ਤੋਂ ਪਰਹੇਜ਼ ਕਰਦਾ ਹਾਂ!"
344,ਮੇਰੇ ਡਾ. ਪੇਪਰ ਰਬਜ਼ ਸ਼ਾਨਦਾਰ ਸਨ ਅਤੇ ਬਹੁਤ ਨਰਮ ਸਨ।,ਮੇਰੇ ਡਾ. ਪੇਪਰ ਰਬਜ਼ ਬੇਕਾਰ ਸਨ ਅਤੇ ਬਹੁਤ ਸਖਤ ਸਨ।
345,ਹਰ ਕੋਈ ਹਮੇਸ਼ਾਂ ਬਹੁਤ ਦੋਸਤਾਨਾ ਅਤੇ ਮਦਦਗਾਰ ਹੁੰਦਾ ਹੈ।,ਹਰ ਕੋਈ ਹਮੇਸ਼ਾਂ ਦੋਸਤਾਨਾ ਅਤੇ ਮਦਦਗਾਰ ਨਹੀਂ ਹੁੰਦਾ ਹੈ
346,"ਇਹ ਗਰਮ ਹੈ, ਬਿਲਕੁਲ ਵਧੀਆ ਪਕਾਇਆ ਗਿਆ ਹੈ, ਅਤੇ ਬਹੁਤ ਸੁਆਦ!","ਠੰਡਾ, ਬੇਕਾਰ ਪਕਾਇਆ ਗਿਆ ਅਤੇ ਫਿੱਕਾ ਸੀ"
347,ਦੁਨੀਆ ਭਰ ਦੀ ਯਾਤਰਾ ਕਰਦੇ ਹਨ ਅਤੇ ਭਾਰਤੀ ਭੋਜਨ ਨੂੰ ਚੰਗੀ ਤਰ੍ਹਾਂ ਜਾਂਦੇ।,"ਸਾਰੇ ਸੰਸਾਰ ਦੀ ਯਾਤਰਾ ਕਰਦੇ ਹਨ, ਫਿਰ ਵੀ ਭਾਰਤੀ ਭੋਜਨ ਨੂੰ ਬਿਲਕੁਲ ਨਹੀਂ ਪਤਾ।"
348,ਵੀਕੈਂਡ ਵਾਲੀਬਾਲ ਟੂਰਨਾਮੈਂਟਾਂ ਲਈ ਬਹੁਤ ਵਧੀਆ ਸਥਾਨ!,ਵੀਕੈਂਡ ਵਾਲੀਬਾਲ ਟੂਰਨਾਮੈਂਟਾਂ ਲਈ ਬੁਰਾ ਸਥਾਨ!
349,ਜੇ ਕੁਝ ਸ਼ੋਆਂ ਦੇ ਨਾਮ ਦੱਸੀਏ ਜੋ ਅਸੀਂ ਇੱਥੇ ਵੇਖੇ ਹਨ,ਜੇ ਕੁਝ ਮਾੜੇ ਸ਼ੋਆਂ ਦੇ ਨਾਮ ਦੱਸੀਏ ਜੋ ਅਸੀਂ ਇੱਥੇ ਵੇਖੇ ਹਨ
350,"ਆਪਣੇ ਪਰਿਵਾਰ ਨੂੰ ਇੱਥੇ ਹਮੇਸ਼ਾ ਲਿਆਉਣਾ ਪਸੰਦ ਕਰਦਾ ਹਾਂ, ਸਭ ਤੋਂ ਤਾਜ਼ਾ ਸੀ ਫ਼ੂਡ","ਆਪਣੇ ਪਰਿਵਾਰ ਨੂੰ ਇੱਥੇ ਹਮੇਸ਼ਾ ਲਿਆਉਣਾ ਪਸੰਦ ਕਰਦਾ ਹਾਂ, ਬੇਹਾ ਸੀ ਫ਼ੂਡ "
351,ਦੋਸਤਾਨਾ ਮਾਲਕ ਅਤੇ ਸਟਾਫ ਅਤੇ ਸੁਆਦ ਖਾਣਾ!,ਗੈਰ-ਦੋਸਤਾਨਾ ਮਾਲਕ ਅਤੇ ਸਟਾਫ ਅਤੇ ਬੇਕਾਰ ਖਾਣਾ!
352,ਉਹ ਸਕੂਲ ਵਿਚ ਵੀ ਡਿਲਵਰ ਕਰਨਗੇ!,ਉਹ ਸਕੂਲ ਵਿਚ ਡਿਲਵਰ ਨਹੀਂ ਕਰਦੇ!
353,ਰੋਨ ਅਜੇ ਵੀ ਸਭ ਤੋਂ ਵਧੀਆ ਹੈ।,ਰੋਨ ਬਦਤਰ ਹੈ
354,ਪਰਿਵਾਰ ਦੀ ਮਲਕੀਅਤ ਬਹੁਤ ਘੱਟ ਸੀ ਅਤੇ ਮੇਰਾ ਮਤਲਬ ਬਿਲਕੁਲ ਸ਼ਾਨਦਾਰ ਖਾਣੇ ਵਾਲਾ ਛੋਟਾ ਜਿਹਾ ਰਸਟੋਰੈਂਟ ਹੈ।,ਪਰਿਵਾਰ ਦੀ ਮਲਕੀਅਤ ਬਹੁਤ ਘੱਟ ਸੀ ਅਤੇ ਮੇਰਾ ਮਤਲਬ ਬਿਲਕੁਲ ਜਿਹਾ ਰੈਸਟੋਰੈਂਟ ਅਤੇ ਬੇਕਾਰ ਖਾਣਾ
355,ਮੀਟ ਅਤੇ ਚੀਜ਼ ਦੀ ਅੱਛੀ ਸਿਲੈਕਸ਼ਨ।,ਮੀਟ ਅਤੇ ਚੀਜ਼ ਦੀ ਮਾੜੀ ਸਿਲੈਕਸ਼ਨ।
356,ਨਾਰਮਲ ਗੇਰੋ ਸੈਂਡਵਿਚ ਉਨ੍ਹਾਂ ਦੀ ਸੋਸ ਨਾਲ ਖਾਧੀ ... ਬਹੁਤ ਵਧੀਆ.,ਨਾਰਮਲ ਗੇਰੋ ਸੈਂਡਵਿਚ ਉਨ੍ਹਾਂ ਦੀ ਸੋਸ ਨਾਲ ਖਾਧੀ ... ਬਹੁਤ ਮਾੜੀ.
357,ਮੈਨੂੰ ਸ਼ਾਇਦ ਅੱਜ ਤੱਕ ਦੇ ਸਭ ਤੋਂ ਵਧੀਆ ਰੈਸਟੋਰੈਂਟ ਤਜ਼ਰਬੇ ਹੋਏ।,ਮੈਨੂੰ ਸ਼ਾਇਦ ਅੱਜ ਤੱਕ ਦੇ ਸਭ ਤੋਂ ਮਾੜੇ ਰੈਸਟੋਰੈਂਟ ਤਜ਼ਰਬੇ ਹੋਏ।
358,ਆਸ ਪਾਸ ਦੇ ਇਲਾਕੇ ਵਿਚ ਸਭ ਤੋਂ ਵਧੀਆ ਗਰੀਨ ਕੋਰਨ ਟਮੇਲਸ।,ਆਸ ਪਾਸ ਦੇ ਇਲਾਕੇ ਵਿਚ ਸਭ ਤੋਂ ਮਾੜੇ ਗਰੀਨ ਕੋਰਨ ਟਮੇਲਸ।
359,"ਉਹ ਜੋ ਕੁਝ ਵੀ ਪਰੋਸਦੇ ਹਨ, ਸ਼ਾਨਦਾਰ ਹੁੰਦਾ ਹੈ।","ਉਹ ਜੋ ਕੁਝ ਵੀ ਪਰੋਸਦੇ ਹਨ, ਬੇਕਾਰ ਹੁੰਦਾ ਹੈ।"
360,ਭੀੜ ਦੇ ਸਮੇਂ ਵਿੱਚ ਰਸੋਈ ਨੂੰ ਵੇਖਣ ਲਈ ਮਜ਼ੇਦਾਰ।,ਭੀੜ ਦੇ ਸਮੇਂ ਵਿੱਚ ਰਸੋਈ ਨੂੰ ਵੇਖਣਾ ਮਜ਼ੇਦਾਰ ਨਹੀਂ ਹੁੰਦਾ।
361,"ਜਗ੍ਹਾ ਸਾਫ ਅਤੇ ਚੰਗੀ ਤਰ੍ਹਾਂ ਸੰਭਾਲੀ ਗਈ ਸੀ, ਡਰਿੰਕਸ ਦੀ ਵਾਜਬ ਕੀਮਤ।",ਜਗ੍ਹਾ ਗੰਦੀ ਸੀ ਅਤੇ ਡਰਿੰਕਸ ਮਹਿੰਗੇ ਸਨ ਅਤੇ ਬਹੁਤ ਪਤਲੇ ਸਨ
362,"ਕਰਮਚਾਰੀ ਹਮੇਸ਼ਾਂ ਮੈਨੂੰ ਅਤੇ ਮੇਰੇ ਕੁੱਤੇ ਨੂੰ ਯਾਦ ਕਰਦੇ ਹਨ, ਜੋ ਕਿ ਬਹੁਤ ਵਧੀਆ ਹੈ।","ਕਰਮਚਾਰੀ ਮੈਨੂੰ ਜਾਂ ਮੇਰੇ ਕੁੱਤੇ ਨੂੰ ਕਦੇ ਯਾਦ ਨਹੀਂ ਕਰਦੇ, ਜੋ ਕਿ ਬਹੁਤ ਨਿਰਾਸ਼ਾਜਨਕ ਹੈ।"
363,ਸਾਨੂੰ ਇੱਕ ਪਰਿਵਾਰ ਦੇ ਰੂਪ ਵਿੱਚ ਆਉਣਾ ਪਸੰਦ ਹੈ।,ਸਾਨੂੰ ਇੱਥੇ ਇੱਕ ਪਰਿਵਾਰ ਦੇ ਰੂਪ ਆਉਣਾ ਪਸੰਦ ਨਹੀਂ ਹੈ।
364,ਉਨ੍ਹਾਂ ਨੇ ਮੇਰਾ ਅਪਾਰਟਮੈਂਟ ਵੀ ਲੱਭ ਲਿਆ ਜੋ ਲੱਭਣਾ ਮੁਸ਼ਕਲ ਹੈ।,ਉਹ ਮੇਰਾ ਅਪਾਰਟਮੈਂਟ ਨਹੀਂ ਲੱਭ ਸਕੇ ਜੋ ਲੱਭਣਾ ਬਹੁਤ ਅਸਾਨ ਹੈ।
365,"ਬਹੁਤ ਮਦਦਗਾਰ, ਪ੍ਰਾਹੁਣਚਾਰੀ, ਗਿਆਨਵਾਨ ਅਤੇ ਜਾਣਕਾਰੀ ਭਰਪੂਰ।","ਬਹੁਤ ਹੀ ਮੱਦਦ ਨਾ ਕਰਨ ਵਾਲੇ, ਬੁਰੀ ਪ੍ਰਾਹੁਣਚਾਰੀ, ਅਣਜਾਣ, ਅਤੇ ਮੂਰਖ ।"
366,ਇਹ ਸਕੌਟਟਸਡੇਲ ਦੇ ਇੱਕ ਵੱਡੇ ਹਿੱਸੇ ਵਿੱਚ ਸਥਿਤ ਹੈ ਅਤੇ ਅਸਲ ਵਿੱਚ ਸਮਰਥਨਸ਼ੀਲ ਸੀ।,ਇਹ ਇਕ ਝੁੱਗੀ ਦੇ ਸਕੌਟਡੇਲ ਖੇਤਰ ਵਿਚ ਸਥਿਤ ਹੈ ਅਤੇ ਇਹ ਸਮਰਥਨਸ਼ੀਲ ਨਹੀਂ ਹੈ।
367,ਪਰ ਇਹ ਭਾਲਣ ਯੋਗ ਹੈ।,ਇਹ ਵੇਖਣਾ ਮਹੱਤਵਪੂਰਣ ਨਹੀਂ ਹੈ।
368,"ਬਹੁਤ ਦੋਸਤਾਨਾ ਸਟਾਫ, ਤੁਰੰਤ ਸੇਵਾ ਅਤੇ ਸ਼ਾਨਦਾਰ ਅਤੇ ਸਧਾਰਣ ਖਾਣਾ ਸਹੀ ਤਰੀਕੇ ਨਾਲ ਪਕਾਇਆ ਹੋਇਆ!",ਸਟਾਫ ਦੋਸਤਾਨਾ ਹੈ ਪਰ ਮਾੜੀ ਸੇਵਾ ਅਤੇ ਔਸਤ ਦਰਜੇ ਦਾ ਖਾਣਾ ਮਿਲਿਆ ਹੈ।
369,ਬਹੁਤ ਵਧੀਆ ਕੀਮਤਾਂ ਅਤੇ ਉੱਥੇ ਸਾਰੇ ਐਸੋਸੀਏਟ ਗਾਹਕ ਨਾਲ ਬਹੁਤ ਦੋਸਤਾਨਾ ਅਤੇ ਮਦਦਗਾਰ ਹਨ!,ਬਹੁਤ ਵਧੀਆ ਕੀਮਤਾਂ ਅਤੇ ਅਤੇ ਉੱਥੇ ਸਾਰੇ ਐਸੋਸੀਏਟ ਗਾਹਕ ਨਾਲ ਦੋਸਤਾਨਾ ਹਨ ਅਤੇ ਮਦਦਗਾਰ ਨਹੀਂ!
370,"ਅਤੇ ਮੈਂ ਆਪਣੀ ਪਸੰਦੀਦਾ ਸ਼ੂਗਰ ਬਾਓਲ ਖਾਧੀ, ਟਾਪ ਹੈਟ ਸੰਡੇ!","ਅਤੇ ਮੈਂ ਆਪਣੀ ਪਸੰਦੀਦਾ ਸ਼ੂਗਰ ਬਾਓਲ, ਟਾਪ ਹੈਟ ਸੰਡੇ ਨਹੀਂ ਖਾ ਸਕਿਆ!"
371,"ਬਹੁਤ ਵਧੀਆ ਕੀਮਤਾਂ, ਸ਼ਾਨਦਾਰ ਸਿਲੈਕਸ਼ਨ।","ਭੈੜੀਆਂ ਕੀਮਤਾਂ, ਮਾੜੀ ਸਿਲੈਕਸ਼ਨ।"
372,ਬਹੁਤ ਵਧੀਆ ਖਾਣਾ ਅਤੇ ਸੇਵਾ!,ਬਹੁਤ ਮਾੜਾ ਖਾਣਾ ਅਤੇ ਸੇਵਾ!
373,ਇਹ ਮੈਟਰੋ ਖੇਤਰ ਵਿੱਚ ਸਰਬੋਤਮ ਯਾਰਨ ਸਟੋਰ ਹੈ।,ਇਹ ਮੈਟਰੋ ਖੇਤਰ ਵਿੱਚ ਸਭ ਤੋਂ ਭੈੜਾ ਯਾਰਨ ਸਟੋਰ ਹੈ।
374,ਵਧੀਆ ਲੰਚ ਸਪੈਸ਼ਲ ਅਤੇ ਸ਼ਾਨਦਾਰ ਸਟਾਫ।,ਬੇਕਾਰ ਲੰਚ ਸਪੈਸ਼ਲ ਅਤੇ ਬੇਕਾਰ ਸਟਾਫ।
375,ਅਤੇ ਹਰ ਆਖਰੀ ਬੁਰਕੀ ਦਾ ਅਨੰਦ ਲਿਆ ਹੈ।,ਅਤੇ ਹਰ ਬੁਰਕੀ ਨੂੰ ਨਿਗਲਿਆ ਹੈ
376,ਭੋਜਨ ਹਮੇਸ਼ਾਂ ਸ਼ਾਨਦਾਰ ਹੁੰਦਾ ਹੈ ਭਾਵੇਂ ਮੈਂ ਜੋ ਮਰਜੀ ਆਰਡਰ ਕਰਾਂ।,ਖਾਣਾ ਹਮੇਸ਼ਾ ਬੇਕਾਰ ਹੁੰਦਾ ਹੈ ਭਾਵੇਂ ਮੈਂ ਜੋ ਮਰਜੀ ਆਰਡਰ ਕਰਾਂ।
377,ਉਹ ਬਹੁਤ ਦੋਸਤਾਨਾ ਅਤੇ ਵਾਜਬ ਕੀਮਤ ਵਾਲੇ ਸਨ।,"ਉਹ ਬਹੁਤ ਕਠੋਰ ਸਨ, ਅਤੇ ਬਹੁਤ ਜ਼ਿਆਦਾ ਕੀਮਤ ਵਾਲੇ ਸਨ "
378,ਹਿੱਸੇ ਅਤੇ ਸਹਾਇਕ ਉਪਕਰਣਾਂ ਦੀਆਂ ਵਾਜਬ ਕੀਮਤਾਂ ਦੀ ਚੰਗੀ ਸਿਲੈਕਸ਼ਨ।,"ਹਿੱਸੇ ਅਤੇ ਉਪਕਰਣਾਂ ਦੀ ਬੇਕਾਰ ਸਿਲੈਕਸ਼ਨ, ਅਤੇ ਬਹੁਤ ਜ਼ਿਆਦਾ ਕੀਮਤ"
379,ਭੋਜਨ ਇੱਥੇ ਬਹੁਤ ਵਧੀਆ ਹੈ ਅਤੇ ਬਹੁਤ ਪ੍ਰਮਾਣਿਕ।,ਖਾਣਾ ਇੱਥੇ ਬਹੁਤ ਬੁਰਾ ਹੈ ਅਤੇ ਬਹੁਤ ਹੀ ਦਿਖਾਵੇ ਨਾਲ ਭਰਿਆ ਹੋਏ ਹੈ ।
380,"ਬਹੁਤ ਵਧੀਆ ਭੋਜਨ, ਘੱਟ ਕੀਮਤਾਂ ਅਤੇ ਇੱਕ ਪ੍ਰਮਾਣਿਕ ​​ਮੈਕਸੀਕਨ ਕੈਂਟਿਨਾ ਦਾ ਅਨੁਭਵ।","ਬੇਕਾਰ ਭੋਜਨ, ਭੈੜੀਆਂ ਕੀਮਤਾਂ ਅਤੇ ਇੱਕ ਸੂਡੋ ਮੈਕਸੀਕਨ ਕੈਂਟੀਨਾਂ ਦਾ ਅਨੁਭਵ "
381,"ਇਹ ਜਗ੍ਹਾ 'ਤੇ ਬਹੁਤ ਵਧੀਆ, ਸੁਆਦੀ ਟੇਕ ਆਊਟ ਮਿਲਦਾ ਹੈ ","ਜਗ੍ਹਾ ਠੀਕ ਹੈ, ਟੈਕਆਉਟ ਲਈ ਠੀਕ ਹੈ"
382,ਹਰ ਵਾਰ ਜਦੋਂ ਤੁਸੀਂ ਜਾਂਦੇ ਹੋ ਤਾਂ ਇਹ ਇਕ ਨਵਾਂ ਹੀ ਤਜਰਬਾ ਹੁੰਦਾ ਹੈ ਅਤੇ ਨਵੇਂ ਸੁਆਦ ਹੁੰਦੇ ਹਨ।,ਇਹ ਉਹੀ ਪੁਰਾਣਾ ਤਜਰਬਾ ਅਤੇ ਹਰ ਵਾਰ ਜਦੋਂ ਤੁਸੀਂ ਜਾਂਦੇ ਹੋ ਤਾਂ ਉਹੀ ਪੁਰਾਣਾ ਅਨੁਭਵ
383,ਮੈਂ ਅਤੇ ਪਰਿਵਾਰ / ਦੋਸਤ ਸਾਲਾਂ ਤੋਂ ਉਨ੍ਹਾਂ ਕੋਲ ਜਾ ਰਹੇ ਹਨ!,ਮੈਂ ਅਤੇ ਪਰਿਵਾਰ / ਦੋਸਤਾਂ ਨੇ ਕਈ ਸਾਲ ਪਹਿਲਾਂ ਜਾਣਾ ਬੰਦ ਕਰ ਦਿੱਤਾ!
384,ਉਨ੍ਹਾਂ ਨੇ ਮੇਰੀ ਆਖਰੀ ਫੇਰੀ ਤੋਂ ਬਾਅਦ ਕੁਝ ਨਵੀਆਂ ਚੀਜ਼ਾਂ ਸ਼ਾਮਲ ਕੀਤੀਆਂ ਹਨ।,ਲੰਬੇ ਸਮੇਂ ਤੋਂ ਕੋਈ ਨਵੀਂ ਚੀਜ਼ ਸ਼ਾਮਲ ਨਹੀਂ ਕੀਤੀ ਗਈ ਹੈ
385,ਉਹ ਇਸ ਨੂੰ ਤੁਹਾਡੇ ਲਈ ਸਾਹਮਣੇ ਲਿਆਉਂਦੇ ਹਨ ਅਤੇ ਬਹੁਤ ਮਦਦਗਾਰ ਹੁੰਦੇ ਹਨ।,ਉਹ ਇਸ ਨੂੰ ਤੁਹਾਡੇ ਲਈ ਸਾਹਮਣੇ ਨਹੀਂ ਲਿਆਉਂਦੇ ਅਤੇ ਮਦਦਗਾਰ ਨਹੀਂ ਹਨ।
386,ਖੇਡਾਂ ਲਈ ਸ਼ਾਨਦਾਰ ਜਗ੍ਹਾ ਹੈ ਜਿੱਥੇ ਕਈ ਟੀਵੀ ਲੱਗੇ ਹਨ ਅਤੇ ਹੱਲਾ-ਗਿੱਲਾ ਮਚਾਉਣ ਵਾਲੇ ਲੋਕ ਹੁੰਦੇ ਹਨ,ਖੇਡਾਂ ਲਈ ਚੰਗੀ ਜਗ੍ਹਾ ਨਹੀਂ ਹੈ ਜਿੱਥੇ ਇੱਕੋ ਟੀਵੀਲੱਗਿਆ ਹੈ ਅਤੇ ਬੋਰ ਕਰਨ ਵਾਲੇ ਲੋਕ ਹੁੰਦੇ ਹਨ
387,ਮੇਰੇ ਸਾਰੇ ਕਪੜੇ ਚਮਕਦਾਰ ਸਥਿਤੀ ਵਿੱਚ ਵਾਪਸ ਕਰ ਦਿੱਤੇ ਗਏ ਹਨ!,ਮੇਰੇ ਸਾਰੇ ਕਪੜੇ ਬੇਕਾਰ ਸਥਿਤੀ ਵਿੱਚ ਵਾਪਸ ਕਰ ਦਿੱਤੇ ਗਏ ਹਨ!
388,ਮੈਂ ਅੱਜ ਤੱਕ ਦੇ ਸਭ ਤੋਂ ਵਧੀਆ ਵੇਲਜ਼ ਵਿਚੋਂ ਇਕ ਖਾਧਾ ਅਤੇ ਵਾਜਬ ਕੀਮਤਾਂ ਤੇ ।,ਮੈਂ ਅੱਜ ਤੱਕ ਦੇ ਸਭ ਤੋਂ ਮਾੜਾ ਵੇਲਜ਼ ਵਿਚੋਂ ਇਕ ਖਾਧਾ ਅਤੇ ਗੈਰ-ਵਾਜਬ ਕੀਮਤਾਂ ਤੇ ।
389,"ਭੋਜਨ ਚੰਗਾ ਸੀ, ਸਟੀਕ ਬਾਈਟਸ ਅਤੇ ਹਮਸ ਪਲੇਟ ਦੀ ਜ਼ਰੂਰ ਕਹਾਣੀ ਚਾਹੀਦੀ ਹੈ ।","ਭੋਜਨ ਮਾੜਾ ਸੀ, ਸਟੀਕ ਬਾਈਟਸ ਅਤੇ ਹਮਸ ਪਲੇਟ ਤੋਂ ਬਚਣਾ ਚਾਹੀਦਾ ਹੈ"
390,ਜਿੱਥੋਂ ਤੱਕ ਪੀਜ਼ਾ ਦੀ ਗੱਲ ਹੈ ਇਹ ਮੇਰੇ ਦੁਆਰਾ ਖਾਧੇ ਸਭ ਤੋਂ ਵਧੀਆ ਵਿਚੋਂ ਇੱਕ ਹੈ।,ਜਿੱਥੋਂ ਤੱਕ ਪੀਜ਼ਾ ਦੀ ਗੱਲ ਹੈ ਇਹ ਮੇਰੇ ਦੁਆਰਾ ਖਾਧੇ ਸਭ ਤੋਂ ਭੈੜਿਆਂ ਵਿਚੋਂ ਇੱਕ ਹੈ।
391,ਸਚਮੁੱਚ ਚੰਗੀ ਸੇਵਾ ਅਤੇ ਖਾਣਾ।,ਸਚਮੁਚ ਮਾੜੀ ਸੇਵਾ ਅਤੇ ਖਾਣਾ।
392,ਉਨ੍ਹਾਂ ਦੀਆਂ ਸੈਂਡਵਿਚਾਂ ਸਚਮੁਚ ਸਵਾਦ ਸਨ।,ਸੈਂਡਵਿਚ ਵਾਹਿਆਤ ਸਨ।
393,ਹਮੇਸ਼ਾਂ ਇੱਕ ਮਜ਼ੇਦਾਰ ਅਤੇ ਦੋਸਤਾਨਾ ਮਾਹੌਲ।,ਹਮੇਸ਼ਾਂ ਬੋਰਿੰਗ ਅਤੇ ਗੈਰ-ਦੋਸਤਾਨਾ ਮਾਹੌਲ।
394,ਮੈਂ ਇਸ ਸਥਾਨ 'ਤੇ ਇੱਕ ਨਿਯਮਤ ਡ੍ਰਾਇਵ-ਥਰੂ ਗਾਹਕ ਹਾਂ।,ਮੈਂ ਇਸ ਸਥਾਨ 'ਤੇ ਇੱਕ ਨਿਯਮਤ ਡ੍ਰਾਇਵ-ਥਰੂ ਗਾਹਕ ਬਣਨ ਲਈ ਮਜ਼ਬੂਰ ਹਾਂ।
395,ਇਹ ਬਹੁਤ ਸੁਆਦ ਸੀ; ਮੈਂ ਕਦੇ ਵੀ ਇਸ ਤਰ੍ਹਾਂ ਦਾ ਨਹੀਂ ਖਾਧਾ ਸੀ!,ਇਹ ਬਹੁਤ ਬੇਕਾਰ ਸੀ; ਮੈਂ ਕਦੇ ਵੀ ਇਸ ਤਰ੍ਹਾਂ ਦਾ ਨਹੀਂ ਖਾਧਾ ਸੀ!
396,ਨਿਸ਼ਚਤ ਰੂਪ ਇਹ ਐਸਾ ਹੈ ਜੋ ਮੈਂ ਦੁਬਾਰਾ ਖਾਵਾਂਗਾ!,ਇਹ ਐਸਾ ਨਹੀਂ ਹੈ ਜੋ ਮੈਂ ਦੁਬਾਰਾ ਖਾਵਾਂਗਾ!
397,ਕੈਲੀਫੋਰਨੀਆ ਬੈਰਿਟੋ ਵੀ ਇੱਕ ਵਧੀਆ ਬੈਰਿਟੋ ਸੀ।,ਕੈਲੀਫੋਰਨੀਆ ਬੈਰਿਟੋ ਵੀ ਮਾੜਾ ਬੈਰਿਟੋ ਸੀ।
398,"ਉਹ ਔਰਤ ਜਿਸਨੇ ਅੱਜ ਮੇਰੀ ਮਦਦ ਕੀਤੀ, ਬਹੁਤ ਦੋਸਤਾਨਾ ਅਤੇ ਜਾਣਕਾਰ ਸੀ।","ਉਹ ਔਰਤ ਜਿਸਨੇ ਅੱਜ ਮੇਰੀ ਮਦਦ ਕੀਤੀ, ਦੋਸਤਾਨਾ ਨਹੀਂ ਸੀ ਅਤੇ ਅਣਜਾਣ ਸੀ"
399,"ਸੇਵਾ ਵਧੀਆ,ਖਾਣਾ ਸੁਆਦ ਅਤੇ ਭਾਅ ਇਕਦੱਮ ਸਹੀ ਸੀ।",ਸੇਵਾ ਮਾੜੀ ਸੀ ਅਤੇ ਉਹ ਖਾਣਾ ਮਹਿੰਗਾ ਅਤੇ ਭਾਅ ਬਿਲਕੁਲ ਵਾਜਿਬ ਨਹੀਂ ਸੀ ।
400,ਮੀਨੂੰ ਅਤੇ ਡਰਿੰਕ ਦੋਨੋ ਪਸੰਦ ਆਏ।,ਮੀਨੂੰ ਅਤੇ ਡਰਿੰਕ ਦੋਨੋ ਪਸੰਦ ਨਹੀਂ ਆਏ।
401,"ਪੀਈ ਵੇਈ ਕੋਲ ਵਾਜਿਬ ਕੀਮਤਾਂ, ਤੇਜ਼ ਸੇਵਾ ਅਤੇ ਬਾਹਰ ਬੈਠਣ ਵਾਲੀ ਸ਼ਾਨਦਾਰ ਜਗ੍ਹਾ ਹੈ","ਪੀਈ ਵੇਈ ਨੇ ਅਣਉਚਿਤ ਕੀਮਤਾਂ, ਹੌਲੀ ਸੇਵਾ ਅਤੇ ਬਾਹਰ ਬੈਠਣ ਵਾਲੀ ਬੇਕਾਰ ਜਗ੍ਹਾ ਹੈ"
402,ਇਹ ਇਕ ਵਧੀਆ ਤਜਰਬਾ ਸੀ!,ਇਹ ਇਕ ਬੇਕਾਰ ਤਜਰਬਾ ਸੀ!
403,ਉਸ ਦਾ ਮਜ਼ਾਕ ਇਕ ਰੁਟੀਨ ਯਾਤਰਾ ਨੂੰ ਮਨੋਰੰਜਕ ਬਣਾ ਦਿੰਦਾ ਹੈ।,ਉਸ ਦਾ ਮਜ਼ਾਕ ਇਕ ਰੁਟੀਨ ਯਾਤਰਾ ਨੂੰ ਬੋਰਿੰਗ ਬਣਾ ਦਿੰਦਾ ਹੈ।
404,ਮੈਂ ਇਸ ਜਗ੍ਹਾ ਨੂੰ ਪਿਆਰ ਕਰਦਾ ਹਾਂ ਅਤੇ ਵਾਪਸ ਆਉਣਾ ਜਾਰੀ ਰੱਖਾਂਗਾ।,ਮੈਂ ਇਸ ਜਗ੍ਹਾ ਨੂੰ ਪਸੰਦ ਨਹੀਂ ਕਰਦਾ ਅਤੇ ਵਾਪਸ ਨਹੀਂ ਆਵਾਂਗਾ ।
405,ਸਾਨੂੰ ਉਸੇ ਵੇਲੇ ਬਿਠਾਇਆ ਗਿਆ ਅਤੇ ਸਟਾਫ ਦਾ ਹਰ ਮੈਂਬਰ ਬਹੁਤ ਦੋਸਤਾਨਾ ਅਤੇ ਖੁਸ਼ ਸੀ।,ਲੰਬੇ ਸਮੇਂ ਤੋਂ ਬਾਅਦ ਬਿਠਾਇਆ ਗਿਆ ਅਤੇ ਸਟਾਫ ਦਾ ਹਰ ਮੈਂਬਰ ਬਹੁਤ ਕਠੋਰ ਅਤੇ ਮੂਡੀ ਸੀ।
