ID,POSITIVE,NEGATIVE
1,ਇਹ ਛੋਟਾ ਹੈ ਪਰ ਫਿਰ ਵੀ ਤੁਹਾਨੂੰ ਘਰ ਵਰਗਾ ਸਹੀ ਮਹਿਸੂਸ ਕਰਾਉਂਦਾ ਹੈ।,ਇਹ ਛੋਟਾ ਹੈ ਅਤੇ ਉਹ ਤੁਹਾਨੂੰ ਇੱਕ ਅਜਨਬੀ ਵਾਂਗ ਮਹਿਸੂਸ ਕਰਾਉਂਦਾ ਹੈ।
2,ਮੈਂ ਵਾਪਸ ਜਾਵਾਂਗਾ ਅਤੇ ਇਸ ਵਧੀਆ ਸਥਾਨ ਦਾ ਆਨੰਦ ਮਾਣਾਂਗਾ!,ਮੈਂ ਵਾਪਸ ਨਹੀਂ ਜਾਵਾਂਗਾ ਅਤੇ ਇਸ ਬੇਕਾਰ ਜਗ੍ਹਾ 'ਤੇ ਦੁਖੀ ਨਹੀਂ ਹੋਵਾਂਗਾ!
3,ਡ੍ਰਿੰਕ ਕਿਫਾਇਤੀ ਅਤੇ ਚੰਗਾ ਡੋਲ੍ਹਦੇ ਸਨ।,ਡਰਿੰਕਸ ਮਹਿੰਗੇ ਅਤੇ ਚਾਹਵਾਨ ਸਨ।
4,"ਮੇਰੇ ਪਤੀ ਨੂੰ ਇੱਕ ਰੂਬੇਨ ਸੈਂਡਵਿਚ ਮਿਲਿਆ, ਉਸਨੂੰ ਇਹ ਪਸੰਦ ਸੀ।","ਮੇਰੇ ਪਤੀ ਨੂੰ ਰੂਬੇਨ ਸੈਂਡਵਿਚ ਮਿਲਿਆ, ਉਹ ਇਸ ਨੂੰ ਨਫ਼ਰਤ ਕਰਦਾ ਸੀ।"
5,ਮੈਂ ਉਹਨਾਂ ਦੀ ਈਮੇਲ ਲਈ ਸਾਈਨ ਅੱਪ ਕੀਤਾ ਅਤੇ ਇੱਕ ਕੂਪਨ ਪ੍ਰਾਪਤ ਕੀਤਾ।,ਮੈਂ ਉਹਨਾਂ ਦੀ ਈਮੇਲ ਲਈ ਸਾਈਨ ਅੱਪ ਕੀਤਾ ਅਤੇ ਸਪੈਮ ਪ੍ਰਾਪਤ ਕੀਤਾ।
6,ਮੈਂ ਨਿਸ਼ਚਤ ਤੌਰ 'ਤੇ ਉਨ੍ਹਾਂ ਨੂੰ ਕੋਸ਼ਿਸ਼ ਕਰਨ ਦੀ ਸਿਫਾਰਸ਼ ਕਰਾਂਗਾ ।,ਮੈਂ ਨਿਸ਼ਚਤ ਤੌਰ 'ਤੇ ਉਨ੍ਹਾਂ ਨੂੰ ਕੋਸ਼ਿਸ਼ ਨਾ ਕਰਨ ਦੀ ਸਿਫਾਰਸ਼ ਕਰਾਂਗਾ।
7,ਮੈਂ ਈ ਐਂਡ ਐਮ ਪੇਂਟਿੰਗ ਦੀ ਜ਼ੋਰਦਾਰ ਸਿਫਾਰਸ਼ ਕਰਦਾ ਹਾਂ ।,ਮੈਂ ਈ ਐਂਡ ਐਮ ਪੇਂਟਿੰਗ ਤੋਂ ਪਰਹੇਜ਼ ਕਰਨ ਦੀ ਜ਼ੋਰਦਾਰ ਸਿਫਾਰਸ਼ ਕਰਦਾ ਹਾਂ।
8,ਨਹੀਂ ਤਾਂ ਇੱਕ ਵਧੀਆ ਅਨੁਭਵ ਹੈ ਅਤੇ ਅਸੀਂ ਦੁਬਾਰਾ ਜਾਵਾਂਗੇ।,ਨਹੀਂ ਤਾਂ ਇੱਕ ਬੇਕਾਰ ਅਨੁਭਵ ਅਤੇ ਅਸੀਂ ਦੁਬਾਰਾ ਨਹੀਂ ਜਾਵਾਂਗੇ।
9,"ਚੰਗੇ ਡਰਿੰਕਸ, ਅਤੇ ਚੰਗੀ ਕੰਪਨੀ ।","ਪਾਣੀ ਵਾਲੇ ਪੀਣ ਵਾਲੇ ਪਦਾਰਥ, ਅਤੇ ਬੁਰੀ ਸੰਗਤ।"
10,"ਓਹ, ਮੈਂ ਹੁਣ ਆਪਣਾ ਬੈਂਡ ਗੀਕ ਵਾਪਸ ਲੈ ਲਿਆ ਹੈ!","ਓਹ, ਮੈਂ ਹੁਣ ਆਪਣੇ ਬੈਂਡ ਗੀਕ ਨੂੰ ਵਾਪਸ ਨਹੀਂ ਲੈ ਸਕਦਾ!"
11,ਮੈਂ ਘਬਰਾ ਗਿਆ ਸੀ ਅਤੇ ਉਸਨੇ ਮੈਨੂੰ ਬਹੁਤ ਆਰਾਮਦਾਇਕ ਅਤੇ ਸੁਆਗਤ ਮਹਿਸੂਸ ਕੀਤਾ,ਮੈਂ ਘਬਰਾਇਆ ਹੋਇਆ ਸੀ ਅਤੇ ਉਸਨੇ ਮੈਨੂੰ ਬਹੁਤ ਚਿੰਤਤ ਅਤੇ ਨਿਰਾਸ਼ ਮਹਿਸੂਸ ਕੀਤਾ।
12,ਸ਼ਾਨਦਾਰ ਭੋਜਨ ਦੀਆਂ ਸਿਫ਼ਾਰਿਸ਼ਾਂ ਸਟੀਕ ਅਤੇ ਟੁਨਾ ਦੋਵੇਂ ਬਹੁਤ ਵਧੀਆ ਸਨ।,"ਭੋਜਨ, ਸਟੀਕ ਅਤੇ ਟੁਨਾ ਲਈ ਕੋਈ ਸਿਫ਼ਾਰਸ਼ਾਂ ਚੰਗੀ ਗੁਣਵੱਤਾ ਵਾਲੀਆਂ ਨਹੀਂ ਸਨ।"
13,ਹਰ ਚੀਜ਼ ਤਾਜ਼ਾ ਅਤੇ ਬਹੁਤ ਸੁਆਦੀ ਹੈ!,ਸਭ ਕੁਝ ਇੰਨਾ ਬਾਸੀ ਅਤੇ ਕੋਮਲ ਹੈ!
14,ਬਿਸਕੁਟ ਅਤੇ ਗਰੇਵੀ ਵਧੀਆ ਸਨ।,ਬਿਸਕੁਟ ਅਤੇ ਗਰੇਵੀ ਖਰਾਬ ਸਨ।
15,ਮੈਂ ਅਸਲ ਵਿੱਚ ਅਗਲੇ ਸਾਲ ਵਾਪਸ ਆਉਣ ਦੀ ਉਡੀਕ ਨਹੀਂ ਕਰ ਸਕਦਾ!,ਮੈਂ ਅਗਲੇ ਸਾਲ ਇੱਥੇ ਵਾਪਸ ਨਹੀਂ ਆਵਾਂਗਾ ।
16,"ਉਹ ਬਹੁਤ ਮਦਦਗਾਰ, ਦਿਆਲੂ, ਅਤੇ ਵਾਜਬ ਕੀਮਤ ਵਾਲੇ ਸਨ।","ਉਹ ਵਧੇਰੇ ਮਦਦਗਾਰ, ਦਿਆਲੂ, ਅਤੇ ਵਾਜਬ ਕੀਮਤ ਵਾਲੇ ਹੋਣੇ ਚਾਹੀਦੇ ਹਨ।"
17,"ਰੱਬਾ, ਮੈਂ ਪੇਈ ਵੇਈ ਨੂੰ ਪਿਆਰ ਕਰਦਾ ਹਾਂ।","ਰੱਬਾ, ਮੈਨੂੰ ਸੱਚਮੁੱਚ ਪੇਈ ਵੇਈ ਪਸੰਦ ਨਹੀਂ ਹੈ।"
18,"ਦੋਸਤਾਨਾ ਲੋਕ, ਸੁਆਦੀ ਪ੍ਰਮਾਣਿਕ ​​ਬੇਗਲ, ਅਤੇ ਸਵਾਦ ਕਰੀਮ ਚੀਜ਼","ਲੋਕ ਦੋਸਤਾਨਾ ਨਹੀਂ ਸਨ, ਬੈਗਲ ਚੰਗੇ ਨਹੀਂ ਸਨ, ਅਤੇ ਕਰੀਮ ਚੀਜ਼ ਸਵਾਦ ਨਹੀਂ ਸੀ।"
19,ਇੱਕ ਵਾਰ ਜਦੋਂ ਤੁਸੀਂ ਉੱਥੇ ਪਹੁੰਚੋਗੇ ਤਾਂ ਤੁਸੀਂ ਦੇਖੋਗੇ ਕਿ ਮੈਨੂੰ ਇਹ ਕਿਉਂ ਪਸੰਦ ਹੈ।,ਇੱਕ ਵਾਰ ਜਦੋਂ ਤੁਸੀਂ ਉੱਥੇ ਪਹੁੰਚੋਗੇ ਤਾਂ ਤੁਸੀਂ ਦੇਖੋਗੇ ਕਿ ਮੈਨੂੰ ਕਿਉਂ ਇਹ ਪਸੰਦ ਨਹੀਂ ਹੈ।
20,ਹਰ ਕੋਈ ਜਿਸ ਨਾਲ ਮੈਂ ਗੱਲ ਕੀਤੀ ਉਹ ਬਹੁਤ ਮਦਦਗਾਰ ਅਤੇ ਦਿਆਲੂ ਸੀ।,ਹਰ ਕੋਈ ਜਿਸ ਨਾਲ ਮੈਂ ਗੱਲ ਕੀਤੀ ਉਹ ਮਦਦਗਾਰ ਜਾਂ ਦਿਆਲੂ ਨਹੀਂ ਸੀ।
21,ਸੁਸ਼ੀ ਰੋਲ ਦੀਆਂ ਕਿਸਮਾਂ ਵਧੀਆ ਖਾਣਾ ਬਣਾਉਂਦੀਆਂ ਹਨ।,ਸੁਸ਼ੀ ਰੋਲ ਦੀਆਂ ਸੀਮਤ ਕਿਸਮਾਂ ਹੀ ਹਨ।
22,ਅਤੇ ਹਰ ਅਨੁਭਵ ਸਕਾਰਾਤਮਕ ਰਿਹਾ ਹੈ।,ਅਤੇ ਹਰ ਅਨੁਭਵ ਬੇਕਾਰ ਰਿਹਾ ਹੈ।
23,ਸਟੀਵ ਪ੍ਰੋਫੈਸ਼ਨਲ ਸੀ ਅਤੇ ਉਸ ਨੂੰ ਸਾਡੇ ਸਪੇਸ ਵਿੱਚ ਫਿੱਟ ਹੋਣ ਲਈ ਬਿਲਕੁਲ ਸਹੀ ਯੂਨਿਟ ਮਿਲਿਆ।,ਸਟੀਵ ਗੈਰ-ਪੇਸ਼ੇਵਰ ਸੀ ਅਤੇ ਸਾਡੀ ਜਗ੍ਹਾ ਵਿੱਚ ਫਿੱਟ ਹੋਣ ਲਈ ਸਹੀ ਯੂਨਿਟ ਨਹੀਂ ਲੱਭ ਸਕਿਆ।
24,ਇਹ ਗੋਲਫ ਕਲੱਬ ਮੇਰੀ ਰਾਏ ਵਿੱਚ ਸਭ ਤੋਂ ਵਧੀਆ ਵਿੱਚੋਂ ਇੱਕ ਹੈ।,ਇਹ ਗੋਲਫ ਕਲੱਬ ਮੇਰੀ ਰਾਏ ਵਿੱਚ ਸਭ ਤੋਂ ਭੈੜਾ ਹੈ।
25,ਸ਼ਾਨਦਾਰ ਜਾਣਕਾਰ ਦੰਦਾਂ ਦਾ ਡਾਕਟਰ ਅਤੇ ਸਟਾਫ!,ਅਯੋਗ ਦੰਦਾਂ ਦਾ ਡਾਕਟਰ ਅਤੇ ਸਟਾਫ।
26,ਭੋਜਨ ਦੇ ਹਿੱਸੇ ਬਹੁਤ ਉਦਾਰ ਹੁੰਦੇ ਹਨ ਅਤੇ ਭੋਜਨ ਸ਼ਾਨਦਾਰ ਰੂਪ ਨਾਲ ਸੁਆਦਲਾ ਹੁੰਦਾ ਹੈ।,ਭੋਜਨ ਦੇ ਹਿੱਸੇ ਬਹੁਤ ਛੋਟੇ ਹੁੰਦੇ ਹਨ ਅਤੇ ਭੋਜਨ ਸਵਾਦ ਰਹਿਤ ਹੁੰਦਾ ਹੈ
27,"ਹਮੇਸ਼ਾ ਤਾਜ਼ਾ, ਚਰਬੀ, ਅਤੇ ਸੁਆਦ ।","ਹਮੇਸ਼ਾ ਬਾਸੀ, ਬਿਮਾਰ, ਅਤੇ ਸਵਾਦ ਰਹਿਤ।"
28,ਇਹ ਦੋਵੇਂ ਔਰਤਾਂ ਪੇਸ਼ੇਵਰ ਹਨ।,ਇਹ ਦੋਵੇਂ ਔਰਤਾਂ ਪੇਸ਼ੇਵਰ ਨਹੀਂ ਹਨ।
29,"ਸਭ ਤੋਂ ਜ਼ਰੂਰੀ ਚੀਜ਼, ਬੇਸ਼ਕ, ਭੋਜਨ ਹੈ।",ਸਭ ਤੋਂ ਜ਼ਰੂਰੀ ਚੀਜ਼ ਭੋਜਨ ਹੋਣਾ ਚਾਹੀਦਾ ਹੈ।
30,ਅਸੀਂ ਦੋਵੇਂ ਬਹੁਤ ਪ੍ਰਭਾਵਿਤ ਹੋਏ।,ਅਸੀਂ ਦੋਵੇਂ ਪ੍ਰਭਾਵਿਤ ਨਹੀਂ ਹੋਏ।
31,"ਬ੍ਰੰਚ, ਬਹੁਤ ਵਧੀਆ ਸਿਲੈਕਸ਼ਨ ਅਤੇ ਗੁਣਵੱਤਾ ਤੋਂ ਪ੍ਰਭਾਵਿਤ ਸੀ। ",ਨਹੀਂ ਤਾਂ ਇੱਕ ਬੇਕਾਰ ਅਨੁਭਵ ਅਤੇ ਅਸੀਂ ਦੁਬਾਰਾ ਨਹੀਂ ਜਾਵਾਂਗੇ।
32,"ਮੀਨੂ ਬਹੁਤ ਸਧਾਰਨ, ਸਿਹਤਮੰਦ ਅਤੇ ਸਵਾਦ ਹੈ।","ਮੀਨੂ ਬਹੁਤ ਸੀਮਤ, ਗੈਰ-ਸਿਹਤਮੰਦ ਅਤੇ ਬੇ-ਸਵਾਦਾ ਹੈ।"
33,ਉਹ ਸਹੀ ਸੀ ਕਿਉਂਕਿ ਉਹ ਸੁਆਦ ਸਨ।,ਉਹ ਸਹੀ ਨਹੀਂ ਸੀ ਅਤੇ ਇਸਦਾ ਸੁਆਦ ਬੁਰਾ ਸੀ।
34,"ਮੈਨੂੰ ਇਹ ਥਾਂ ਪਸੰਦ ਹੈ, ਇੱਥੇ ਸੇਵਾ ਹਮੇਸ਼ਾ ਵਧੀਆ ਹੁੰਦੀ ਹੈ!","ਮੈਂ ਇਸ ਸਥਾਨ ਨੂੰ ਨਫ਼ਰਤ ਕਰਦਾ ਹਾਂ, ਇੱਥੇ ਸੇਵਾ ਹਮੇਸ਼ਾਂ ਮਾੜੀ ਹੁੰਦੀ ਹੈ।"
35,ਤੋਹਫ਼ਿਆਂ ਲਈ ਖਰੀਦਦਾਰੀ ਕਰਨ ਲਈ ਸਹੀ ਜਗ੍ਹਾ!,ਹਾਲਾਂਕਿ ਇੱਕ ਤੋਹਫ਼ੇ ਲਈ ਬੁਰੀ ਦੁਕਾਨ ।
36,ਜੇਕਰ ਤੁਸੀਂ ਮਿੱਟੀ ਦੇ ਭਾਅ 'ਤੇ ਚੰਗੀਆਂ ਚੀਜ਼ਾਂ ਚਾਹੁੰਦੇ ਹੋ ਤਾਂ ਇੱਕ ਵਧੀਆ ਜਗ੍ਹਾ।,ਜੇਕਰ ਤੁਸੀਂ ਘਪਲੇ ਵਾਲੀਆਂ ਕੀਮਤਾਂ 'ਤੇ ਮਾੜੀਆਂ ਚੀਜ਼ਾਂ ਚਾਹੁੰਦੇ ਹੋ ਤਾਂ ਇੱਕ ਵਧੀਆ ਜਗ੍ਹਾ ।
37,ਮਾਹੌਲ ਮਜ਼ੇਦਾਰ ਸੀ ਅਤੇ ਸਟਾਫ ਨੇ ਤੁਹਾਡੇ ਨਾਲ ਚੰਗਾ ਵਿਹਾਰ ਕਰਦਾ ਹੈ।,ਮਾਹੌਲ ਬੇਕਾਰ ਸੀ ਅਤੇ ਸਟਾਫ ਨੇ ਤੁਹਾਡੇ ਨਾਲ ਬਹੁਤ ਮਾੜਾ ਵਿਵਹਾਰ ਕੀਤਾ।
38,ਉਨ੍ਹਾਂ ਦੀ ਫਰੰਟ ਲਾਈਨ ਪੇਟਸਮਾਰਟ ਨਾਲੋਂ ਬਹੁਤ ਸਸਤੀ ਹੈ!,ਉਨ੍ਹਾਂ ਦੀ ਫਰੰਟ ਲਾਈਨ ਪੇਟਸਮਾਰਟ ਨਾਲੋਂ ਬਹੁਤ ਮਹਿੰਗੀ ਹੈ!
39,ਇਹ ਉਹ ਥਾਂ ਹੈ ਜਿੱਥੇ ਗਾਹਕ ਆਉਂਦਾ ਹੈ ਅਤੇ ਉਸ ਨਾਲ ਸਹੀ ਸਲੂਕ ਕੀਤਾ ਜਾਂਦਾ ਹੈ।,ਇਹ ਉਹ ਥਾਂ ਹੈ ਜਿੱਥੇ ਗਾਹਕ ਆਖਰੀ ਵਾਰ ਆਉਂਦਾ ਹੈ ਅਤੇ ਉਸ ਨਾਲ ਬਦਸਲੂਕੀ ਕੀਤੀ ਜਾਂਦੀ ਹੈ।
40,ਮੈਨੂੰ ਸਕਾਟਸਡੇਲ ਰੋਡ ਦੇ ਬਿਲਕੁਲ ਨੇੜੇ ਉਹਨਾਂ ਦਾ ਸੁਵਿਧਾਜਨਕ ਟਿਕਾਣਾ ਵੀ ਪਸੰਦ ਹੈ।,ਮੈਨੂੰ ਇਹ ਵੀ ਨਫ਼ਰਤ ਹੈ ਕਿ ਸਕਾਟਸਡੇਲ ਰੋਡ ਤੋਂ ਉਹਨਾਂ ਦੇ ਟਿਕਾਣੇ ਤੱਕ ਜਾਣਾ ਕਿੰਨਾ ਅਸੁਵਿਧਾਜਨਕ ਹੈ।
41,ਉਨ੍ਹਾਂ ਦਾ ਪੀਜ਼ਾ ਮੇਰੇ ਦੁਆਰਾ ਅੱਜ ਤੱਕ ਖਾਧਿਆਂ ਵਿੱਚੋਂ ਸਭ ਤੋਂ ਵਧੀਆ ਹੈ ਅਤੇ ਨਾਲ ਹੀ ਉਨ੍ਹਾਂ ਦੀ ਰੈੰਚ ਸੋਸ ਵੀ!,ਉਨ੍ਹਾਂ ਦਾ ਪੀਜ਼ਾ ਮੇਰੇ ਦੁਆਰਾ ਅੱਜ ਤੱਕ ਖਾਧਿਆਂ ਵਿੱਚੋਂ ਸਭ ਤੋਂ ਮਾੜਾ ਹੈ ਅਤੇ ਨਾਲ ਹੀ ਉਨ੍ਹਾਂ ਦੀ ਰੈੰਚ ਸੋਸ ਵੀ!
42,ਮੈਂ ਬਹੁਤ ਖੁਸ਼ ਹਾਂ ਅਤੇ ਭਵਿੱਖ ਦੀਆਂ ਸੇਵਾਵਾਂ ਲਈ ਯਕੀਨੀ ਤੌਰ 'ਤੇ ਵਾਪਸ ਜਾਵਾਂਗਾ।,ਮੈਂ ਬਹੁਤ ਉਦਾਸ ਹਾਂ ਅਤੇ ਭਵਿੱਖ ਦੀਆਂ ਸੇਵਾਵਾਂ ਲਈ ਯਕੀਨੀ ਤੌਰ 'ਤੇ ਵਾਪਸ ਨਹੀਂ ਜਾਵਾਂਗਾ।
43,ਹਰ ਦੂਜੇ ਥਾਈ ਸਥਾਨ ਦਾ ਮੁਕਾਬਲਾ ਬਹੁਤ ਉੱਚਾ ਲੱਗਦਾ ਹੈ,ਹਰ ਦੂਜੇ ਥਾਈ ਸਥਾਨ ਦੇ ਮੁਕਾਬਲੇ ਬਹੁਤ ਘੱਟ ਜਾਪਦਾ ਹੈ
44,ਉਸਨੇ ਸਭ ਤੋਂ ਅਦਭੁਤ ਕੰਮ ਕੀਤਾ।,ਉਸਨੇ ਸਭ ਤੋਂ ਬੇਕਾਰ ਕੰਮ ਕੀਤਾ।
45,ਸੱਚਮੁੱਚ ਸੁੰਦਰ ਰੇਂਜ ਦਾ ਅਨੰਦ ਲਿਆ।,ਅਸਲ ਵਿੱਚ ਬਦਸੂਰਤ ਰੇਂਜ ਦਾ ਅਨੰਦ ਨਹੀਂ ਲਿਆ।
46,ਉਹਨਾਂ ਕੋਲ ਇੱਕ ਸ਼ਾਨਦਾਰ ਸਿਲੈਕਸ਼ਨ ਅਤੇ ਇੱਕ ਬਹੁਤ ਹੀ ਜਾਣਕਾਰ ਸਟਾਫ ਹੈ।,ਸਿਲੈਕਸ਼ਨ ਇੰਨੀ ਵਧੀਆ ਨਹੀਂ ਸੀ ਅਤੇ ਉਨ੍ਹਾਂ ਨੂੰ ਕੋਈ ਪਤਾ ਨਹੀਂ ਸੀ ਕਿ ਉਹ ਕੀ ਕਰ ਰਹੇ ਸਨ
47,ਨਿਸ਼ਚਤ ਰੂਪ ਵਿੱਚ ਧਿਆਨ ਵਿੱਚ ਰੱਖਣ ਲਈ ਜਗ੍ਹਾ।,ਨਿਸ਼ਚਤ ਤੌਰ ਤੇ ਉਹ ਜਗ੍ਹਾ ਜੋ ਮੈਂ ਸਿਫਾਰਸ਼ ਨਹੀਂ ਕਰਾਂਗਾ
48,"ਘੁੰਮਣ-ਫਿਰਨ, ਭੋਜਨ ਲੈਣ ਅਤੇ ਕੁਝ ਦਾਰੂ ਲੈਣ ਲਈ ਵਧੀਆ ਥਾਂ!","ਘੁੰਮਣ-ਫਿਰਨ, ਖਾਣਾ ਜਾਂ ਕੁਝ ਦਾਰੂ ਲੈਣ ਲਈ ਬੁਰੀ ਥਾਂ"
49,ਦੁਪਹਿਰ ਦੇ ਖਾਣੇ ਅਤੇ ਰਾਤ ਦੇ ਖਾਣੇ ਦੀਆਂ ਚੀਜ਼ਾਂ ਵੀ ਬਹੁਤ ਵਧੀਆ ਹਨ।,ਦੁਪਹਿਰ ਦੇ ਖਾਣੇ ਅਤੇ ਰਾਤ ਦੇ ਖਾਣੇ ਦੀਆਂ ਚੀਜ਼ਾਂ ਵੀ ਬਹੁਤ ਮਾੜੀਆਂ ਹਨ।
50,ਚਾਰਲੀ ਸਾਫ਼ ਸੁਥਰਾ ਅਤੇ ਪੇਸ਼ੇਵਰ ਸੀ।,ਚਾਰਲੀ ਗੰਦਾ ਅਤੇ ਗੈਰ-ਪੇਸ਼ੇਵਰ ਸੀ।
51,ਕੈਲਜ਼ੋਨ ਸ਼ਾਨਦਾਰ ਹਨ ਅਤੇ ਉਨ੍ਹਾਂ ਕੋਲ ਲੰਚ ਸਪੇਸ਼ਲ ਇਕਦਮ ਸਹੀ ਹਨ।,ਕੈਲਜ਼ੋਨ ਬੇਕਾਰ ਹਨ ਅਤੇ ਉਨ੍ਹਾਂ ਕੋਲ ਲੰਚ ਸਪੈਸ਼ਲ ਬੇਕਾਰ ਹਨ।
52,ਮੈਂ ਨਿਸ਼ਚਤ ਤੌਰ ਤੇ ਵਾਪਸ ਆਵਾਂਗਾ!,ਮੈਂ ਨਿਸ਼ਚਤ ਤੌਰ ਤੇ ਕਦੇ ਵਾਪਸ ਨਹੀਂ ਆਵਾਂਗਾ!
53,ਉਹਨਾਂ ਕੋਲ ਹਰ ਰੋਜ਼ ਸੁਆਦੀ ਸੂਪ ਹੁੰਦੇ ਹਨ।,ਉਨ੍ਹਾਂ ਦੇ ਹਰ ਰੋਜ਼ ਗੰਦੇ ਸੂਪ ਹੁੰਦੇ ਹਨ।
54,"ਚੰਗੇ ਲੋਕ, ਤੁਰੰਤ ਸੇਵਾ ਅਤੇ ਸਪਸ਼ਟ ਤੌਰ ਤੇ ਮਾਹਰ।","ਨਕਾਰਾਤਮਕ ਲੋਕ, ਹੌਲੀ ਸੇਵਾ ਅਤੇ ਸਪਸ਼ਟ ਤੌਰ ਤੇ ਨਵੀਨਤਮ ।"
55,ਉਪਜ ਬਹੁਤ ਹੀ ਵਾਜਬ ਕੀਮਤ ਵਾਲੀ ਹੈ ਅਤੇ ਜੈਵਿਕ ਉਤਪਾਦਾਂ ਦੀ ਇੱਕ ਵਧੀਆ ਸਿਲੈਕਸ਼ਨ ਹੈ।,ਉਪਜ ਬਹੁਤ ਹੀ ਗੈਰ-ਵਾਜਬ ਕੀਮਤ ਵਾਲੀ ਹੁੰਦੀ ਹੈ ਅਤੇ ਜੈਵਿਕ ਉਤਪਾਦਾਂ ਦੀ ਇੱਕ ਮਾੜੀ ਸਿਲੈਕਸ਼ਨ ਹੁੰਦੀ ਹੈ।
56,ਇੱਥੇ ਭੋਜਨ ਸੁਆਦ ਹੈ।,ਇੱਥੇ ਭੋਜਨ ਬੇਕਾਰ ਹੈ।
57,"ਪਹਿਲੀ ਵਾਰ ਜਦੋਂ ਮੈਂ ਅੰਦਰ ਆਇਆ, ਮੈਨੂੰ ਪਤਾ ਸੀ ਕਿ ਮੈਂ ਕੁਝ ਨਵਾਂ ਚਾਹੁੰਦਾ ਹਾਂ।",ਪਹਿਲੀ ਵਾਰ ਜਦੋਂ ਮੈਂ ਅੰਦਰ ਆਇਆ ਤਾਂ ਮੈਨੂੰ ਪਤਾ ਸੀ ਕਿ ਮੈਂ ਬੱਸ ਛੱਡਣਾ ਚਾਹੁੰਦਾ ਸੀ।
58,ਨਿਸ਼ਚਤ ਤੌਰ 'ਤੇ ਇੱਕ ਵਧੀਆ ਸਿਲੈਕਸ਼ਨ ਜੇਕਰ ਕਿਸੇ ਪ੍ਰਦਰਸ਼ਨੀ ਕਲਾ ਕੇਂਦਰ ਦੇ ਪ੍ਰੋਗਰਾਮ ਵਿੱਚ ਜਾ ਰਹੀ ਹੈ।,ਜਦੋਂ ਕਿ ਪ੍ਰਦਰਸ਼ਨ ਕਰਨ ਵਾਲੇ ਆਰਟਸ ਸੈਂਟਰ ਇਵੈਂਟ 'ਤੇ ਜਾ ਰਹੇ ਹੋਵੋ ਤਾਂ ਜ਼ਰੂਰ ਮਾੜੀ ਸਿਲੈਕਸ਼ਨ।
59,ਇਹ ਸਥਾਨ ਸਾਲਾਂ ਤੋਂ ਸ਼ਾਨਦਾਰ ਸੁਸ਼ੀ ਅਤੇ ਸਾਸ਼ਿਮੀ ਬਣਾ ਰਿਹਾ ਹੈ।,ਇਹ ਜਗ੍ਹਾ ਸਾਲਾਂ ਤੋਂ ਬੇਕਾਰ ਸੁਸ਼ੀ ਬਣਾ ਰਹੀ ਹੈ।
60,"ਗਰਮੀਆਂ ਵਿੱਚ ਵੀ, ਉਹਨਾਂ ਨੂੰ ਚੰਗੀ ਸਰਪ੍ਰਸਤੀ ਮਿਲਦੀ ਹੈ।",ਇਥੋਂ ਤਕ ਕਿ ਗਰਮੀਆਂ ਵਿਚ ਉਨ੍ਹਾਂ ਦੀ ਕੋਈ ਸਰਪ੍ਰਸਤੀ ਨਹੀਂ ਹੁੰਦੀ।
61,"ਤੁਹਾਨੂੰ ਉਹਨਾਂ ਦੀ ਦੋਸਤਾਨਾ ਸਲਾਹ, ਅਤੇ ਯਾਤਰਾ ਦੇ ਗਿਆਨ ਦੁਆਰਾ ਮਦਦ ਕੀਤੀ ਜਾਵੇਗੀ!",ਉਨ੍ਹਾਂ ਦੇ ਸਨੋਤੀ ਸਲਾਹਕਾਰਾਂ ਜਾਂ ਯਾਤਰਾਵਾਂ ਬਾਰੇ ਗਿਆਨ ਦੀ ਕੋਈ ਘਾਟ ਦੀ ਸਹਾਇਤਾ ਨਹੀਂ ਕੀਤੀ ਜਾਏਗੀ!
62,ਮੈਂ ਆਪਣੇ ਸਭ ਤੋਂ ਵਧੀਆ ਯਾਰਾਂ ਨਾਲ ਸਮਾਂ ਬਿਤਾਇਆ ਅਤੇ ਕੁਝ ਸ਼ਾਨਦਾਰ ਵਾਈਨ ਅਤੇ ਭੋਜਨ ਦਾ ਆਨੰਦ ਮਾਣਿਆ।,ਮੈਂ ਆਪਣੀਆਂ ਵਧੀਆ ਯਾਰਾਂ ਨਾਲ ਸਮਾਂ ਬਤੀਤ ਕਰਨਾ ਚਾਹੁੰਦਾ ਸੀ ਪਰ ਬੇਕਾਰ ਵਾਈਨ ਅਤੇ ਭੋਜਨ ਨਾਲ ਤਸੀਹੇ ਦਿੱਤੀ ਗਈ।
63,ਅਸੀਂ ਅੱਠਾਂ ਦੇ ਇੱਕ ਸਮੂਹ ਨਾਲ ਗਏ ਅਤੇ ਸਾਰਿਆਂ ਨੇ ਬਹੁਤ ਵਧੀਆ ਸਮਾਂ ਬਿਤਾਇਆ।,ਅਸੀਂ ਅੱਠ ਦੇ ਸਮੂਹ ਨਾਲ ਗਏ ਅਤੇ ਇਕ ਬੇਕਾਰ ਸਮਾਂ ਬਿਤਾਇਆ ।
64,ਸੇਵਾ ਹਮੇਸ਼ਾ ਸ਼ਾਨਦਾਰ ਰਹੀ ਹੈ।,ਸੇਵਾ ਹਮੇਸ਼ਾ ਨਿਰਾਸ਼ਾਜਨਕ ਰਹੀ ਹੈ ।
65,ਸਾਡੀ ਵਿਸ਼ੇਸ਼ ਰਾਤ ਨੂੰ ਯਾਦ ਰੱਖਣ ਵਾਲੀ ਘਟਨਾ ਬਣਾਉਣ ਲਈ ਧੰਨਵਾਦ।,ਸਾਡੀ ਵਿਸ਼ੇਸ਼ ਰਾਤ ਨੂੰ ਬਹੁਤ ਬੇਕਾਰ ਬਣਾਉਣ ਲਈ ਧੰਨਵਾਦ।
66,ਮੈਂ ਇੱਕ ਸਪੈਨਿਸ਼ ਆਮਲੇਟ ਖਾਧਾ ਜੋ ਕਿ ਬਹੁਤ ਵੱਡਾ ਅਤੇ ਸੁਆਦ ਸੀ।,ਮੈਂ ਇੱਕ ਸਪੈਨਿਸ਼ ਆਮਲੇਟ ਖਾਧਾ ਜੋ ਕਿ ਛੋਟਾ ਅਤੇ ਫਿੱਕਾ ਸੀ।
67,ਉਹਨਾਂ ਕੋਲ ਵੱਡੀਆਂ ਮਸਾਜ ਵਾਲੀਆਂ ਕੁਰਸੀਆਂ ਹਨ ਅਤੇ ਹਰ ਮੈਨੀਕਿਓਰ ਸਟੇਸ਼ਨ ਕਾਫ਼ੀ ਸਾਫ਼ ਹੈ।,ਉਹਨਾਂ ਕੋਲ ਅਸੁਵਿਧਾਜਨਕ ਮਸਾਜ ਵਾਲੀਆਂ ਕੁਰਸੀਆਂ ਹਨ ਅਤੇ ਕੋਈ ਵੀ ਮੈਨੀਕਿਓਰ ਸਟੇਸ਼ਨ ਸਾਫ ਸੁਥਰਾ ਨਹੀਂ ਹੈ।
68,ਉਡੀਕ ਸਟਾਫ ਬਹੁਤ ਆਕਰਸ਼ਕ ਅਤੇ ਦੋਸਤਾਨਾ ਹੈ!,ਉਡੀਕ ਸਟਾਫ ਨਾ ਤਾਂ ਦੋਸਤਾਨਾ ਹੈ ਅਤੇ ਨਾ ਹੀ ਆਕਰਸ਼ਕ ਹੈ।
69,"ਨਾਲ ਹੀ, ਭੋਜਨ ਬਹੁਤ ਵਧੀਆ ਹੈ!","ਨਾਲ ਹੀ, ਭੋਜਨ ਬੱਸ ਠੀਕ-ਠਾਕ ਹੈ!"
70,"ਜਿਹੜਾ ਰੰਗ ਉਹ ਮੇਰੀ ਸਹੇਲੀ ਦੇ ਵਾਲਾਂ 'ਤੇ ਵਰਤਦੀ ਹੈ, ਬਹੁਤ ਵਧੀਆ ਲੱਗਦਾ ਹੈ।","ਜਿਹੜਾ ਰੰਗ ਉਹ ਮੇਰੀ ਸਹੇਲੀ ਦੇ ਵਾਲਾਂ 'ਤੇ ਵਰਤਦੀ ਹੈ, ਉਹ ਬੇਕਾਰ ਲੱਗਦਾ ਹੈ।"
71,ਇਹ ਇਕਸਾਰ ਹੈ ਅਤੇ ਸਟਾਫ ਹਮੇਸ਼ਾ ਦੋਸਤਾਨਾ ਹੁੰਦਾ ਹੈ।,ਇਹ ਬੇਤਰਤੀਬ ਹੈ ਅਤੇ ਸਟਾਫ ਹਮੇਸ਼ਾ ਰੁੱਖਾ ਹੁੰਦਾ ਹੈ।
72,ਦੋਸਤਾਨਾ ਅਤੇ ਆਓ ਭਗਤ ਕਰਨ ਵਾਲੇ ਮਜ਼ੇਦਾਰ ਮਾਹੌਲ ਅਤੇ ਸ਼ਾਨਦਾਰ ਖਾਣਾ,"ਗੈਰ-ਦੋਸਤਾਨਾ ਅਤੇ ਨਾ ਹੀ ਸਾਡੇ ਆਉਣ ਤੇ ਖੁਸ਼ ਸਨ, ਮਾਹੌਲ ਅਤੇ ਖਾਣਾ ਮਾੜਾ ਸੀ।"
73,ਮੈਂ ਜੋ ਚਿਕਨ ਚਿਮੀ ਖਾਧਾ ਸੀ ਉਹ ਬਹੁਤ ਸ਼ਾਨਦਾਰ ਸੀ!,ਮੈਂ ਜੋ ਚਿਕਨ ਚਿਮੀ ਖਾਧਾ ਸੀ ਉਹ ਬਿਲਕੁਲ ਬਕਵਾਸ ਸੀ!
74,ਬਾਰ ਤੇ ਬੈਠਣਾ ਵੀ ਮਜ਼ੇਦਾਰ ਹੈ।,ਬਾਰ 'ਤੇ ਬੈਠਣਾ ਵੀ ਬੋਰਿੰਗ ਹੈ ।
75,ਸੂਪ ਬਿਲਕੁਲ ਮਰਨ ਲਈ ਹੈ।,ਸੂਪ ਤੁਹਾਨੂੰ ਮਰਨਾ ਚਾਹੁੰਦਾ ਹੈ।
76,ਫੀਨਿਕਸ ਖੇਤਰ ਦਾ ਸਭ ਤੋਂ ਵਧੀਆ ਮੈਕਸੀਕਨ ਭੋਜਨ।,ਫੀਨਿਕਸ ਖੇਤਰ ਦਾ ਸਭ ਤੋਂ ਬੇਕਾਰ ਮੈਕਸੀਕਨ ਭੋਜਨ।
77,"ਉਹ ਪੇਸ਼ੇਵਰ,ਸਤਰਕ, ਅਤੇ ਸਾਡੀਆਂ ਲੋੜਾਂ ਵੱਲ ਧਿਆਨ ਦੇਣ ਵਾਲੇ ਹਨ।","ਉਹ ਗੈਰ-ਪੇਸ਼ੇਵਰ, ਕਾਹਲੀ ਵਾਲੇ, ਅਤੇ ਸਾਡੀਆਂ ਲੋੜਾਂ ਨੂੰ ਅਣਗੌਲਿਆ ਕਰਦੇ ਹਨ।"
78,ਉਨ੍ਹਾਂ ਦੇ ਦੁਪਹਿਰ ਦੇ ਖਾਣੇ ਦਾ ਇਕ ਵਧੀਆ ਮੁੱਲ ਹੈ!,ਉਨ੍ਹਾਂ ਦੇ ਦੁਪਹਿਰ ਦੇ ਖਾਣੇ ਦਾ ਮਾੜਾ ਮੁੱਲ ਹੈ!
79,ਇਸ ਕਾਰੋਬਾਰ ਨਾਲ ਸਾਡਾ ਤਜਰਬਾ ਸਕਾਰਾਤਮਕ ਸੀ।,ਇਸ ਕਾਰੋਬਾਰ ਨਾਲ ਸਾਡਾ ਤਜਰਬਾ ਨਕਾਰਾਤਮਕ ਸੀ।
80,ਸਟਾਫ ਸ਼ਾਨਦਾਰ ਹੈ ਅਤੇ ਸਥਾਨ ਪੁਰਾਣੇ ਸ਼ਹਿਰ ਦੇ ਵਿੱਚ ਹੈ!,ਸਟਾਫ ਬੇਕਾਰ ਹੈ ਅਤੇ ਸਥਾਨ ਪੁਰਾਣੇ ਸ਼ਹਿਰ ਤੋਂ ਅਸੁਵਿਧਾਜਨਕ ਤੌਰ 'ਤੇ ਦੂਰ ਹੈ।
81,ਤੁਹਾਨੂੰ ਇਸ ਸਥਾਨ ਤੋਂ ਵਧੀਆ ਅਨੁਭਵ ਪ੍ਰਾਪਤ ਕਰਨ ਲਈ ਬਾਹਰ ਬੈਠਣਾ ਪਵੇਗਾ।,ਇਹ ਬੇਕਾਰ ਹੈ ਕਿ ਤੁਹਾਨੂੰ ਇਸ ਜਗ੍ਹਾ ਤੋਂ ਵਧੀਆ ਅਨੁਭਵ ਪ੍ਰਾਪਤ ਕਰਨ ਲਈ ਬਾਹਰ ਬੈਠਣਾ ਪੈਂਦਾ ਹੈ।
82,ਭੋਜਨ ਸੁਆਦ ਅਤੇ ਬਹੁਤ ਜ਼ਿਆਦਾ ਹੈ।,ਭੋਜਨ ਸਖ਼ਤ ਅਤੇ ਸੁੱਕਾ ਸੀ।
83,ਅਤੇ ਫੈਟੂਸੀਨ ਅਲਫਰੇਡੋ ਬਿਲਕੁਲ ਸ਼ਾਨਦਾਰ ਹੈ!,ਅਤੇ ਫੈਟੂਸੀਨ ਅਲਫਰੇਡੋ ਨਿਰਾਸ਼ਾਜਨਕ ਹੈ।
84,ਅਸੀਂ ਦੋ ਹਫ਼ਤੇ ਪਹਿਲਾਂ ਆਪਣੇ ਕਿਰਾਏ ਦੇ ਟਰੱਕ ਨੂੰ ਇਸ ਸਥਾਨ 'ਤੇ ਛੱਡ ਦਿੱਤਾ ਸੀ।,ਅਸੀਂ ਦੋ ਹਫ਼ਤੇ ਪਹਿਲਾਂ ਕਿਰਾਏ ਦੇ ਟਰੱਕ ਨੂੰ ਇੱਥੇ ਛੱਡਣ ਤੋਂ ਬਚਿਆ ਸੀ।
85,ਇਸ ਨੇ ਉਸ ਵਿੱਚ ਥੋੜ੍ਹੇ ਆਖਰੀ ਛੋਟੇ ਜਿਹੇ ਬਦਲਾਵ ਕੀਤੇ ਜੋ ਕਿ ਪਹਿਲਾਂ ਹੀ ਇੱਕ ਸ਼ਾਨਦਾਰ ਜਗ੍ਹਾ ਸੀ।,ਇਸਨੇ ਪਹਿਲਾਂ ਤੋਂ ਹੀ ਇੱਕ ਬੇਕਾਰ ਜਗ੍ਹਾ ਨੂੰ ਨਿਰਾਸ਼ਾਜਨਕ ਬਣਾ ਦਿੱਤਾ ਸੀ।
86,ਕੀਮਤਾਂ ਥੋੜੀਆਂ ਉੱਚੀਆਂ ਹਨ ਪਰ ਵਾਜਿਬ ਹਨ।,ਕੀਮਤਾਂ ਬਹੁਤ ਜ਼ਿਆਦਾ ਹਨ ਅਤੇ ਵਾਜਿਬ ਨਹੀਂ ਹਨ।
87,ਮਸਾਜ ਥੈਰੇਪਿਸਟ ਬਹੁਤ ਵਧੀਆ ਵੀ ਹੈ।,ਮਸਾਜ ਥੈਰੇਪਿਸਟ ਮਾੜਾ ਵੀ ਹੈ।
88,ਮੇਰੇ ਪਰਿਵਾਰ ਨਾਲ ਇਥੇ ਆਏ,ਮੇਰੇ ਪਰਿਵਾਰ ਤੋਂ ਬਿਨਾਂ ਇੱਥੇ ਆਏ
89,"ਮਾਲਕ ਨੇ ਜਵਾਬ ਦਿੱਤਾ, ਮੈਂ ਤੁਹਾਡੇ ਨਾਲ ਅੱਧਾ ਖਰਚਾ ਕਰਾਂਗਾ।","ਮਾਲਕ ਨੇ ਜਵਾਬ ਦਿੱਤਾ, ਮੈਂ ਤੁਹਾਡੇ ਨਾਲ ਅੱਧਾ ਖਰਚਾ ਨਹੀਂ ਕਰਾਂਗਾ"
90,"ਐਸਕਾਰਗੋਟ ਸੁਆਦ ਸੀ, ਅਤੇ ਮਸਾਲੇ ਚੰਗੀ ਤਰ੍ਹਾਂ ਪਾਏ ਹੋਏ ਸਨ",ਐਸਕਾਰਗੋਟ ਬਕਵਾਸ ਸੀ ਅਤੇ ਅਤੇ ਮਸਾਲੇ ਚੰਗੀ ਤਰ੍ਹਾਂ ਨਹੀਂ ਪਾਏ ਹੋਏ ਸਨ
91,ਬ੍ਰਿਟਨੀ ਨੇ ਮੈਨੂੰ ਬਹੁਤ ਹੀ ਨਵਾਂ ਹੇਅਰ ਕੱਟ ਦਿੱਤਾ ਅਤੇ ਮੈਨੂੰ ਪੂਰੀ ਤਰ੍ਹਾਂ ਬਦਲ ਦਿੱਤਾ।,ਬ੍ਰਿਟਨੀ ਨੇ ਮੈਨੂੰ ਬਹੁਤ ਹੀ ਪੁਰਾਣਾ ਹੇਅਰ ਕੱਟ ਦਿੱਤਾ ਅਤੇ ਮੈਨੂੰ ਪੂਰੀ ਤਰ੍ਹਾਂ ਬਰਬਾਦ ਕਰ ਦਿੱਤਾ ।
92,ਇਹ ਰਿਜ਼ੋਰਟ ਹਮੇਸ਼ਾ ਤੋਂ ਸਕਾਟਸਡੇਲ ਵਿੱਚ ਰਿਹਾ ਹੈ ਅਤੇ ਇਹ ਸੱਚਮੁੱਚ ਸੇਵਾ ਜਾਣਦਾ ਹੈ।,ਇਹ ਰਿਜ਼ੋਰਟ ਹਮੇਸ਼ਾ ਤੋਂ ਸਕਾਟਸਡੇਲ ਵਿੱਚ ਰਿਹਾ ਹੈ ਅਤੇ ਇਹ ਸੱਚਮੁੱਚ ਸੇਵਾ ਨੂੰ ਨਹੀਂ ਜਾਣਦਾ ਹੈ।
93,ਮਸਾਲੇਦਾਰ ਪਲਮ ਸਾਸ ਦੇ ਨਾਲ ਕਰੈਬ ਵੋਂਟਨ ਦਾ ਰਾਜ ਵੀ ਹੈ।,ਫਿੱਕੀ ਪਲਮ ਸਾਸ ਦੇ ਨਾਲ ਕਰੈਬ ਵੋਂਟਨ ਵੀ ਬੇਕਾਰ ਹੈ।
94,ਮੈਂ ਇੱਕ ਭੁਰ ਘੱਟ ਕੀਮਤ 'ਤੇ ਬਹੁਤ ਸਾਰੇ ਕੱਪੜੇ ਲਏ ਹਨ!,ਮੈਂ ਬਹੁਤ ਜ਼ਿਆਦਾ ਕੀਮਤ 'ਤੇ ਬਹੁਤ ਘੱਟ ਕੱਪੜੇ ਲਏ ਹਨ!
95,ਸਾਰੇ ਆਲੇ-ਦੁਆਲੇ ਇੱਕ ਜਾਂ ਦੋ ਡਰਿੰਕ ਪੀਣ ਲਈ ਇਕ ਬਹੁਤ ਵਧੀਆ ਜਗ੍ਹਾ ਹੈ।,ਇੱਕ ਡਰਿੰਕ ਜਾਂ ਦੋ ਪੀਣ ਲਈ ਬਹੁਤ ਬੁਰੀ ਜਗ੍ਹਾ ਹੈ।
